datasource	domain	setid	srclang	trglang	src	ref1	ref2	ref3
cwmt2009	ce-news	zh_en_news_trans	zh	en	越野车冲入放学人群续：司机踩油门过多所致	Continuation of off-road vehicle rushing into crowd leaving school: caused by driver's excessive use of pedal accelerator	Follow-up report on the off-road vehicle crashing into the off-school crowd: caused by too high throttle	Continued Report on Off-road Vehicle Plunging into Those Released from School: Because Driver Presses Accelerator Excessively
cwmt2009	ce-news	zh_en_news_trans	zh	en	昨日，长春市副市长郑文芝带领相关部门领导到医院看望了受伤学生和家长。	Yesterday, Changchun's Vice Mayor Zheng Wenzhi led leaders of related departments to visit the injured students and their parents in the hospital.	Yesterday, Zheng Wenzhi, deputy mayor of Changchun city headed the relevant department leaders to visit the injured students and their parents in the hospital.	Yesterday, Zheng Wenzhi, Vice Mayor of Changchun, led the leaders from relevant departments to visit the injured students and parents in the hospital.
cwmt2009	ce-news	zh_en_news_trans	zh	en	院方表示，受伤学生均无生命危险，等学生伤情稳定后，校方和医院将对他们开展有针对性的心理辅导。	The hospital indicated none of the injured students' life was in jeopardy and the school and hospital would offer the appropriate psychological counseling to them after their condition stabilized.	The hospital said all the injured students have no life risk. When the students are in stable condition, the school and the hospital will offer pertinent psychological assistance to them.	The hospital indicated that the lives of the injured students were not in danger, and when their condition stabilized, the school and hospital would provide them with pointed psychological counseling.
cwmt2009	ce-news	zh_en_news_trans	zh	en	同时，事故原因已基本查清，肇事司机在事故中负有全部责任。	At the same time, the accident cause has been basically found out and the driver should have full responsibility for the accident.	At the same time, the accident cause has been found out by and large. The driver who caused the trouble shall bear full responsibility for the accident.	Meanwhile, the accident causes have been basically found out and the driver should bear all the responsibility for the accident.
cwmt2009	ce-news	zh_en_news_trans	zh	en	郑文芝副市长看望受伤学生	Vice Mayor Zheng Wenzhi visits injured students	Deputy mayor Zheng Wenzhi visited injured students	Vice Mayor Zheng Wenzhi Visited Injured Students
cwmt2009	ce-news	zh_en_news_trans	zh	en	昨日上午，长春市副市长郑文芝带领朝阳区交警，区教育局等部门领导及工作人员赶赴吉大一院，看望受伤学生。	On the morning of yesterday, Changchun's Vice Mayor Zheng Wenzhi led leaders and staff of Traffic Police Office, Education Bureau and other departments of Chaoyang District to go to the First Hospital of Jilin University for a visit to injured students.	Yesterday morning, Zheng Wenzhi, deputy mayor of Changchun city headed the traffic policemen of Chaoyang district, leaders of the district education bureau and workers to visit the injured students in the First Hospital of Jilin University.	Yesterday morning, Zheng Wenzhi, Vice Mayor of Changchun, led some traffic policemen in Chaoyang District, leaders of the District Education Bureau and some other employees to No. 1 Hospital of Jilin University to visit the injured students.
cwmt2009	ce-news	zh_en_news_trans	zh	en	在一楼病房，郑文芝走到受伤学生和家长床前，询问伤情，并代表政府送上了慰问金。	In a ward on the first floor, Zheng Wenzhi came to the beds of the injured students and their parents to inquire about their injuries and on behalf of the government, to send them consolation money.	In the sickrooms of the first floor, Zheng Wenzhi came to the sickbeds of the injured students and parents, inquired about their condition and presented the consolation money on behalf of the government.	In the ward on the first floor, Zheng Wenzhi came to the sick beds of the injured students and parents, asked about the injuries and distributed the consolation money on behalf of the government.
cwmt2009	ce-news	zh_en_news_trans	zh	en	她说：“受伤的大部分都是孩子，孩子的事就是天大的事，政府一定妥善处理，希望受伤学生早日康复。”	She said: "Most of the injured people are children. Children's things are the most important, so the government will well deal with the accident by all means and I hope the injured students can recover as soon as possible."	She said, "Most of the injured are kids. Anything concerning children is the most important. The government must handle the case properly. I wish the injured students to recover as soon as possible."	She said: "Most of the injured are kids. Issues concerning kids are issues of uttermost importance. The government is surely to handle it properly and it is hoped that the injured students will recover at an early date."
cwmt2009	ce-news	zh_en_news_trans	zh	en	肇事司机和车辆信息确认	Confirmation of the troublemaking driver and vehicle's information	Information of troublemaking driver and car affirmed	Information about troublemaking Driver and Vehicle Confirmed
cwmt2009	ce-news	zh_en_news_trans	zh	en	昨日傍晚，交警经排查，获得了肇事车辆信息：车号为“京KT9576”的肇事车隶属于大唐吉林发电有限公司长春第三热电厂。	On the evening of yesterday, through the investigation, the traffic police got the information on the vehicle causing the traffic accident: the vehicle with the license plate number of "JingKT9576" is owned by Datang Changchun No. 3 Thermal Power Plant.	Yesterday evening, the traffic police got the information about the car with screening investigation: the car that caused the accident coded Jing KT9576 belongs to the third thermal power plant of Changchun, Datang Jilin Power Generation Co. Ltd.	Yesterday evening, through exclusion investigation, the traffic police got the information about troublemaking vehicle: the car, with the vehicle plate number of "Jing KT9576", is owned by Datang Jilin Power Generation Co., ltd Changchun No. 3 Thermal Power Plant.
cwmt2009	ce-news	zh_en_news_trans	zh	en	该车在大唐公司总部所在地北京市登记，但常年在长春市使用。	The vehicle was registered in Beijing, where Datang Corporation is headquartered, but is used in Changchun all the year round.	The car was registered in Beijing, the headquarters of Datang, but was used all year long in Changchun city.	The vehicle was registered in Beijing, the headquarters of China Datang Corporation, but was used in Changchun all year around.
cwmt2009	ce-news	zh_en_news_trans	zh	en	肇事女子名叫姜淑洁，37岁，住在长春市，从其驾驶员等级信息上看，已有14年驾龄，并且平时驾驶出租车营运。	The name of the female driver is Jiang Shujie, who is 37 years old and lives in Changchun. She is a driver of 14 years' standing according to her driver's grade information, and she ordinarily drives a taxi for business.	The female troublemaker was Jiang Shujie, 37 years old, living in Changchun city. The driver information shows that she has been a driver for 14 years and drives a taxi for business at normal times.	The female driver of the vehicle involved in the accident is Jiang Shujie, 37 years old, a resident in Changchun. Judging from her driver level information, she has been driving for 14 years, and usually drives the taxi.
cwmt2009	ce-news	zh_en_news_trans	zh	en	肇事车是姜淑洁的丈夫所负责驾驶的公车。	The vehicle causing the traffic accident is a company-owned vehicle Jiang Shujie's husband drives.	The car that caused the accident is a company car driven by Jiang Shujie's husband.	The vehicle involved in the accident is a business vehicle of which Jiang Shujie's husband is the driver in charge.
cwmt2009	ce-news	zh_en_news_trans	zh	en	事发时，姜淑洁去接孩子放学，把车停在距离校门较远的地方。	Before the accident happened, Jiang Shujie went to school for picking up her child and parked the vehicle comparatively far from the school gate.	Before the accident happened, Jiang Shujie was to pick up her child after school and parked the car at a place far from the school gate.	Before the accident happened, Jiang Shujie was to pick up her kid from school and parked the vehicle at a place a little far from the school gate.
cwmt2009	ce-news	zh_en_news_trans	zh	en	18时左右，她看到自己的孩子从学校出来后，将车辆向前移动，但因仅驾驶过该车两三次，加之对自动档车型操作方式不熟悉，紧张中油门踩下过多，致使车辆撞入人群。	At about 18:00, she saw her child come out of the school and began moving the vehicle towards the school, but as she had only driven the vehicle two or three times and she was not familiar with the operation of a vehicle with automatic transmission, she excessively pressed down the pedal accelerator under tension and drove the vehicle into the crowd.	At about 18:00, when she saw her child coming out of the school, she drove the car forward. Because she had driven the car for two or three times only and was not familiar with the automatic transmission model, she stepped heavily on the throttle pedal out of strain and caused the car to break into the crowd.	At about 18:00, seeing her kid coming out of the school, she moved the vehicle forward. However, as she had just driven the vehicle for two or three times, she was unfamiliar with the way to operate an automatic transmission model, and she was so nervous that she pressed the accelerator excessively and the vehicle was driven into the crowd.
cwmt2009	ce-news	zh_en_news_trans	zh	en	记者从警方了解到，事故中的男性死者叫宫晓吉，是九十中学七年级某班学生家长，在国贸民航售票处工作，事发时正在学校门口接孩子放学。	The reporter learned from the police that the name of the man who died in the accident was Gong Xiaoji, father of a student in a class of the seventh grade of No. 90 Middle School, who worked in the ticket office of Civil Aviation Administration of China at International Trade Hotel and was waiting for his child when the accident happened.	The journalist learned from the police that the man who died from the accident was a parent of a student of Grade VII, No. 90 High School. He worked in the civil aviation ticket office in the International Trade Hotel. When the accident happened, he was to pick up his child at the school gate.	The reporter has learned from the police that the man who died in the accident is Gong Xiaojie, the parent of a student in a class at the 7th grade in No. 90 Middle School. He worked with the Booking Office of Civil Aviation Administration of China at International Trade Hotel. When the accident happened, he was picking up his child at the school gate.
cwmt2009	ce-news	zh_en_news_trans	zh	en	在被撞之前，他已接到孩子正准备离开。	Before being hit by the vehicle, he had picked up his child and was ready for leaving.	Before being hit by the car, he had picked up his child and was ready to leave.	Before being hit, he had picked up his child and was about to leave.
cwmt2009	ce-news	zh_en_news_trans	zh	en	警方勘察现场后发现，他所驾驶的摩托车已挂上一档，准备起车。	After examining the accident scene, the police found he had put his motorcycle into the first gear and was to start the motorcycle.	The police found after investigating the accident site that the motorcycle he drove had been moved into Grade I gear and was ready to go.	Through accident on-site investigation, the police found that the motor cycle gear change was enabled to take off.
cwmt2009	ce-news	zh_en_news_trans	zh	en	交警部门表示，经过现场勘查后确认，姜淑洁在事故中负有全部责任。	After the examination of the accident scene, the traffic police department indicated Jiang Shujie should accept full responsibility for the accident.	The traffic department said that Jiang Shujie was confirmed to bear the full responsibility in the accident with the on-site investigation.	The traffic police suggest that it has been confirmed through on-site investigations that Jiang Shujie should bear full responsibility for the accident.
cwmt2009	ce-news	zh_en_news_trans	zh	en	受伤学生均无生命危险	None of the injured students are in jeopardy of life.	All injured students face no life risk	None of the injured students was in life danger.
cwmt2009	ce-news	zh_en_news_trans	zh	en	事故后最先报警的人，是被卷入车底的学生高启睿。	The one who called the police earliest was Gao Qirui, a student who had got run over by the vehicle.	The first one reporting the accident to police after the accident was a student named Gao Qirui who was entangled underneath the car.	Gao Qirui, the student who was rolled under the vehicle, was the first one to call the police after the accident happened.
cwmt2009	ce-news	zh_en_news_trans	zh	en	昨日，在吉大一院一楼病房，高启睿坐在病床上精神很好，他表示，当时周围的人都在忙着抬车救人，自己被拖出来后先想到了报警，这样能尽量挽救同学们的生命。	Yesterday, in the ward on the first floor of the First Hospital of Jilin University, sitting in the patient bed and looking very well, Gao Qirui said the people around the car were busy lifting the vehicle to rescue the injured at that time, so after he was pulled out from under the car, he first thought of calling the police in order to save schoolmates' lives.	Yesterday Gao Qirui, in good spirit, was sitting in the sickbed of the first floor in the First Hospital of Jilin University. He said at that time people nearby were busy in moving the car and saving victims. When he was taken out, his first thought was to report to the police so as to save lives of his classmates.	Yesterday, in the ward on the first floor in No. 1 Hospital of Jilin University, Gao Qirui was sitting on his sick bed, in good spirits. He said that at the time, people around him were busy moving the vehicle to rescue the injured, and he first thought of calling the police after he was moved out, for it would save the lives of his schoolmates as many as possible.
cwmt2009	ce-news	zh_en_news_trans	zh	en	记者了解到，一位受伤较重的68岁的学生家长，昨日接受了长达7-8个小时的手术。	The reporter learned a severely injured 68-year-old guardian of a student received a 7-to-8-hour operation yesterday.	The journalist learned that a seriously injured parent, 68 years old, received an operation of 7-8 hours yesterday.	The reporter has learned that a student parent, aged 68 and suffering relatively severely, had a seven to eight hour long operation yesterday.
cwmt2009	ce-news	zh_en_news_trans	zh	en	据吉大一院副院长表示，目前所有住院的学生都没有生命危险，其中伤势最重的七年级五班男生刘琳的伤势也很稳定。	Vice president of the First Hospital of Jilin University indicated all of inpatient students were not in jeopardy of life and the condition of Liu Lin, the most severely injured student of the fifth class of the seventh grade, had been stabilized.	According to deputy president of the First Hospital of Jilin University, all the students in hospital had no risk of life. Liu Lin, a Grade VII student who was the most seriously injured, was in stable condition.	As stated by the Vice President of No. 1 Hospital of Jilin University, so far none of the hospitalized students' lives is in danger, and Liu Lin, the boy student in No. 5 Class at Grade 7 who suffered more severely than others, is in steady conditions now.
cwmt2009	ce-news	zh_en_news_trans	zh	en	当时，他身体被压在车下，是周围的家长和老师合力将车体抬起后将他救出的。	Then his body was trapped under the vehicle and the surrounding students' guardians and teachers made concerted efforts to lift the vehicle and to rescue him from under its wheels.	At that time, his body was pressed under the car and he was saved after the surrounding parents and teachers had uplifted the car jointly.	At that time, his body was pressed under the vehicle, and it was the parents and teachers around that made joint efforts to lift the vehicle body and saved him out.
cwmt2009	ce-news	zh_en_news_trans	zh	en	医生表示，多亏了车撞在刘琳身上时他及时倒地，否则要是被车头顶在墙上的话，会有生命危险。	A doctor said if Liu Lin hadn't fallen down in time the moment he was hit by the vehicle, he would have been pushed to the wall by the head of vehicle, and he would have been in jeopardy of life.	Thanks to his timely falling down when the car ran into him, otherwise Liu Lin would have life risk if he was pushed to the wall by the car head, according to a doctor.	The doctors pointed out that luckily, when hit by the vehicle, Liu Lin fell down in the right time, otherwise he might be in life's dangers if crushed against the wall by the car head.
cwmt2009	ce-news	zh_en_news_trans	zh	en	将加强对学校周边管理	The management over school's surroundings should be intensified	To enforce management of the school neighborhood	To Improve Management of School Surroundings
cwmt2009	ce-news	zh_en_news_trans	zh	en	记者从九十中学门前的监控录像上看，随着肇事车辆冲过，原本在校门前左侧的死者连人带车被撞到校门右侧。	The reporter saw from the video monitor recording at the gate of No. 90 Middle School that with the vehicle rushing into the crow, the decedent on the left side of the school gate was dashed by the vehicle to the right side together with his motorcycle.	From the monitor video over the gate area of No. 90 High School, the journalist saw the car that caused the accident dashed over and the decedent originally on the left side of the school gate was bumped to the right side.	The reporter observed from the surveillance video recorded in front of No. 90 Middle School that when the vehicle involved was dashing on, the deceased, on the left side of the school gate at the time, was hit to the right side of the school gate together with his motor cycle.
cwmt2009	ce-news	zh_en_news_trans	zh	en	同时，从屏幕上可以清晰地看到被撞倒的学生。	At the same time, on the screen, it can be clearly seen that students were dashed to the ground.	At the same time, the students who were run down can be seen clearly on the screen.	Meanwhile, it was clear on the video that the students were being knocked down.
cwmt2009	ce-news	zh_en_news_trans	zh	en	朝阳区有关领导表示，马上对学校周边环境进行治理，原来学校保安只负责管理校内的学生，今后，保安将管理校门前接送孩子的家长秩序，包括接送孩子的车辆。	The related leaders of Chaoyang District indicated they would improve the school's surroundings, and formerly, the school's guards only took charge of the management of students in school, but from now on, the guards would be responsible for maintaining the order of guardians who come to meet students, including the management of cars that are used to pick up students.	The relevant leaders of Chaoyang district said they are to immediately improve the neighborhood of the schools. The school guards were originally responsible for student management in the school. But from now on they will be responsible for the order of parents who are to send or pick up their children at the school gate, including vehicles.	Relevant leaders in Chaoyang District announced to put the school surroundings under management immediately. In the past, the school security guards were merely responsible for the management of students inside the campus, but from now on, they are also responsible for the management of orders of parents coming to pick up their children at the school gate, including the vehicles to pick up kids.
cwmt2009	ce-news	zh_en_news_trans	zh	en	昨日下午，记者赶到肇事车所属单位大唐吉林发电有限公司长春第三热电厂，相关工作人员表示，他们昨天中午已开了医疗费的支票，肯定会负责伤者的医疗费用。	On the afternoon of yesterday, the reporter went to Datang Changchun No. 3 Thermal Power Plant, which owned the vehicle causing the accident, and the relevant staff said they had paid the medical expenses by cheques for the injured people and they would take charge of the medical expenses by all means.	Yesterday afternoon, the journalist visited the third thermal power plant of Changchun, Datang Jilin Power Generation Co. Ltd., to which the car causing the accident belonged. The relevant workers said they had written a check for the medical expenses and would be borne the medical expenses of the injured.	Yesterday afternoon, the reporter came to Datang Jilin Power Generation Co., Ltd Changchun No. 3 Thermal Power Plant, the owner of the vehicle involved in the accident. Relevant employees stated that they had written a check for the medical expenses at noon, and would surely be responsible for the medical expenses for the injured.
cwmt2009	ce-news	zh_en_news_trans	zh	en	据校方表示，从学生意外伤害保险，车辆第三者责任险等险种的赔付上会给受伤学生家庭解决一部分困难，一定不会耽误受伤学生的治疗。	The school indicated the compensation from students' accident insurance, the third liability insurance of motor vehicles and other insurances could help solve some difficulties of students' families and the medical treatments of injured students by no means would be interrupted.	The school said the compensation from the accidental injury insurance and the third-party liability insurance would help solve some of the problems of the injured students. The medical treatment to the injured student must not be delayed.	According to the school administrators, payouts of student accident insurance, third party liability insurance of vehicles and other insurances would solve some difficulties for the families whose kids were injured and the medical treatment of the injured students would surely not be delayed.
cwmt2009	ce-news	zh_en_news_trans	zh	en	据了解，九十中学已垫付了部分医疗费用，并给每个受伤学生1000元的慰问金。	According to sources, the No. 90 Middle School has paid partial medical expenses for students and has given each injured student 1,000 yuan of consolation.	It is learned that No. 90 High School has paid part of the medical expenses for the injured and given 1,000 yuan of consolation to each of the injured students.	It is learned that No. 90 Middle School has paid advance for part of the medical expenses, and offered RMB1,000 Yuan consolation money to each injured student.
cwmt2009	ce-news	zh_en_news_trans	zh	en	将对受害学生做心理辅导	To offer psychological counseling to injured students	Psychological assistance to injured students	To Provide Psychological Counseling to Students Involved
cwmt2009	ce-news	zh_en_news_trans	zh	en	死者女儿的舅舅吴先生说，看到爸爸发生车祸后，孩子一直在哭，并不断自责“如果不是去接我，爸爸也不会发生这样的事情”。	Mr. Wu, the decedent's daughter's uncle, said since seeing her father was involved in the accident, the girl had been crying and repeatedly reproaching herself "if not for picking me up, my dad would not have been involved in the traffic accident".	Mr. Wu, uncle of the decedent's daughter, said after seeing the car accident, the kid was crying all the time and blaming herself "if not for picking me up, daddy would not have met such a thing."	Mr. Wu, the uncle of the girl whose father died, said that after seeing the car accident happening to her father, the child kept crying and blaming herself that "my father would not have had such an accident had he not come to pick me up".
cwmt2009	ce-news	zh_en_news_trans	zh	en	大人一直在她身边看护，“就怕她心里负担太大，有啥想不开的。”	Her adult relatives are looking after her, and they said: "we worry that she can't withstand such psychological burden and even commit suicide."	The elders were nursing her, "Fearing she has too heavy mental burden and taken things too hard."	Adults had been caring for her all the time, "fearing that she might be mentally overburdened and take it too much."
cwmt2009	ce-news	zh_en_news_trans	zh	en	昨日下午，记者在吴先生家见到了女孩，她眼睛红肿的厉害，见到陌生人也没多看一眼。	On the afternoon of yesterday, the reporter saw the girl at Mr. Wu's, her eyes were red and swollen and didn't take a second look at strangers.	Yesterday afternoon, the journalist saw the girl at Mr. Wu's. With eyes flare, she turned a blind eye to the stranger.	Yesterday afternoon, the reporter met the girl at Mr. Wu's house. Her eyes were quite red and swollen, and she did not give a further glance at the stranger.
