datasource	domain	setid	srclang	trglang	src	ref1	ref2	ref3
cwmt2009	ce-news	zh_en_news_trans	zh	en	另外，德国、捷克、波兰、法国、意大利、秘鲁、韩国等国家也报告了零星的疑似感染猪流感病例。	Additionally, some other countries, including Germany, Czechoslovakia, Poland, France, Italy, Peru and South Korea, also reported dotted suspected cases of human contracting swine flu.	In addition, Germany, Czech Republic, Poland, France, Italy, Peru and South Korea also reported suspected cases of swine flu.	Besides, Germany, Czech Rep, Poland, France, Italy, Peru, and South Korea also reported a few cases suspected of infection of swine flu.
cwmt2009	ce-news	zh_en_news_trans	zh	en	尽管猪流感在墨西哥和美国暴发并呈蔓延之势，但世卫组织发言人格雷戈里·哈特尔28日说，目前还不建议采取限制旅行和关闭边界的应对措施。	Although the swine flu breaks out and spreads in Mexico and the US, Gregory Hartl, the spokesperson of the WHO, said on April 28, it was not suggested taking response measures of limiting travels or closing the borders.	Though the swine flu outbreaks in Mexico and the US and is spreading, the World Health Organization spokesperson Gregory Hartl said on April 28 that currently WHO did not suggest the coping measures such as limiting travel and closing down the boundary.	Although swine flu has broken out in Mexico and America, and tends to spread, WHO spokesman Gregory Hartl said on 28th that so far, it was not proposed to adopt measures such as restricting traveling or closing off the borders.
cwmt2009	ce-news	zh_en_news_trans	zh	en	因为病毒通常都有一段时间的潜伏期，根据以往经验，这类措施效果甚微。	As the virus has a latent period, those measures couldn't bring about much effect according to the past experience.	It is because the virus normally has a latent period. Based on the past experience, such measures have little effect.	Because generally viruses have a certain period of incubation, and based on past experience, these measures will work little effect.
cwmt2009	ce-news	zh_en_news_trans	zh	en	不过，世卫组织建议，那些已经出现了流感症状的人，最好取消前往或者离开疫区的行程，避免乘坐公共交通工具和到人员密集的地方，并及时就医检查。	However, the WHO suggested the people who had shown the flu symptoms cancel the schedule of leaving for or leaving from the epidemic-stricken areas, avoid taking public transport tools or going into the crowds and go to hospital for examination in time.	However, WHO suggests those who have the symptoms of flu had better cancel the schedule coming to or leaving the epidemic area, avoid taking the public transport vehicles or coming to the crowded place and go to hospital to take examination in time.	Anyhow, the WHO suggests that those having had flu symptoms had better cancel the trips to or from infected regions, and avoid taking public transport vehicles or going to places that are intensive with people, and go to a doctor for checkup promptly.
cwmt2009	ce-news	zh_en_news_trans	zh	en	目前，世卫组织仍在调查此次疫情的最初感染源。	Currently, the WHO is still investigating the sources of infection of this epidemic.	Now WHO is still investigating the original source of the epidemic.	So far, the WHO is still investigating into the initial infection sources of the epidemic.
cwmt2009	ce-news	zh_en_news_trans	zh	en	本报布鲁塞尔4月28日电（驻欧盟记者张兴慧）世界卫生组织4月25日确认墨西哥和美国暴发猪流感疫情后，从墨西哥和美国旅游归来的一些欧洲公民也染上了猪流感病毒。	Brussels April 28 (Zhang Xinghui, the reporter stationed in the EU) After the WHO confirmed the outbreak of the epidemic of swine flu in Mexico and the US, some European citizens who came back from the travels in Mexico and the US also contracted the swine flu virus.	Brussels April 28 (Zhang Xinghui, journalist to EU) The World Health Organization confirmed on April 25 that after the outbreak of swine flu in Mexico and the US, some European citizens having traveled to and returned from Mexico and the US have caught swine flu.	Brussels on April 28th (by Zhang Xinghui, reporter at the European Union) WHO confirmed on April 25th that after the outbreak of swine flu in Mexico and America, some European citizens back from trips to Mexico and America have also contracted the swine flu virus.
cwmt2009	ce-news	zh_en_news_trans	zh	en	欧盟官员和欧洲民众对猪流感给予了高度重视，积极商讨应对之策。	Officials of the EU and European common people attach great importance to the swine flu and positively discussed the counter measures.	EU officers and European public paid high attention to the swine flu and discussed countermeasures vigorously.	EU officials and European masses have attached high importance to swine flu, and proactively discussed the ways to deal with it.
cwmt2009	ce-news	zh_en_news_trans	zh	en	27日，欧盟外长会议在卢森堡召开。	On April 27, the Conference of Foreign Ministers of EU was held in Luxemburg.	On April 27, EU Foreign Ministers Meeting was held in Luxemburg.	On 27th, the EU Conference of Foreign Ministers was held in Luxemburg.
cwmt2009	ce-news	zh_en_news_trans	zh	en	针对正在蔓延的猪流感疫情，欧盟27个成员国的外长将这一突发疫情列为讨论的主要议题。	With regard to the existing epidemic outbreak of swine flu, the foreign ministers of the EU's 27 member states would set the abrupt epidemic situation as the main discussion topic.	For the spreading swine flu, the foreign ministers of 27 members of EU listed the sudden epidemic on the agenda of major topics.	For the spreading swine flu epidemic, the foreign ministers of European Union's 27 members put the outbreak of the epidemic into major topics for discussion.
cwmt2009	ce-news	zh_en_news_trans	zh	en	欧盟轮值主席国捷克副总理冯德拉、外长施瓦岑贝格当天宣布，欧盟将在30日召开卫生部长特别会议，评估目前暴发的猪流感疫情可能给欧盟带来的威胁，以及应当采取的应对措施。	Vondra, vice prime minister of Czechoslovakia in the EU rotating presidency, and Schwarzenberg, foreign minister of Czechoslovakia declared on the same day the EU would hold a special meeting of health ministers to evaluate the current swine flu's possible threats to the EU and the existing response measures.	Alexandr Vondra, the deputy prime minister and Foreign Minister Schwarzenberg of Czech, the current president of the European Union declared on the same day that EU would hold a special meeting of the health ministers, assessing the threat swine flu epidemic might bring to EU and countermeasures that should be taken.	Alexandra Vondra, Deputy Prime Minister of Czech that has taken the rotating presidency of the EU, and the Foreign Minister Schwarzenberg announced on the day that EU would hold the ad hoc meeting of ministers of health on 30th, to assess the possible threats brought by the outbreaks of swine flu epidemic on EU, and the measures that should be taken.
cwmt2009	ce-news	zh_en_news_trans	zh	en	欧盟委员会主席巴罗佐在一份书面声明中说，目前，针对墨西哥猪流感疫情采取的公共卫生紧急措施仅限于北美地区，但其进一步蔓延的风险仍不容忽视。	European Commission President Barroso said in a written statement that currently, the public health emergency measures that are aimed at the epidemic situation of swine flu in Mexico are only taken for the North America but the risk of epidemic outbreak shouldn't be ignored.	Barroso, president of the European Commission said in a written statement that the emergent public health measures for swine flu outbreak in Mexico were only limited to the North America, but the risk of further spread could not be overlooked.	EU Commission Chairman Barroso, in a written statement, said that currently, the public health emergency measures taken against the swine flu epidemic in Mexico are limited to North American regions, but the risks of further spreading can not be ignored.
cwmt2009	ce-news	zh_en_news_trans	zh	en	为此，他本人和欧委会负责卫生事务的委员瓦西利乌将密切跟踪疫情发展。	Thus, he and Vasiliou, the member in charge of the health affairs in the European Commission, will closely follow the development of epidemic situation.	For this he himself and the EU Health Commissioner Vassiliou would follow up the epidemic development closely.	For this, he himself and EU Health Commissioner for Health, will keep close tracking of the epidemic development.
cwmt2009	ce-news	zh_en_news_trans	zh	en	同时，欧委会将与各成员国和世界卫生组织合作，随时评估专家提供的信息，并根据评估结果，采取相关防范措施。	At the same time, the European Commission will cooperate with its member states and the WHO to evaluate the information provided by experts at any moment and will take relevant counter measures based on the evaluation results.	At the same time, European commission would cooperate with all members and WHO to assess the information provided by experts from time to time and take relevant preventative measures according to the assessment results.	Meanwhile, EU Commission will cooperate with its member countries and WHO to assess, at any time, the information provided by experts and based on the assessment results, adopt relevant preventive measures.
cwmt2009	ce-news	zh_en_news_trans	zh	en	27日，欧盟还向欧洲公民发出了警告，呼吁他们推迟不必要的赴墨西哥和美国的旅游计划。	On April 27, the EU also sent warns to European citizens and called on them to delay their unnecessary travel plans to Mexico and the US.	On April 27, EU also released a warning and called on European citizens to put off unnecessary travel plans to Mexico and the US.	On 27th, EU warned the European citizens, and appealed to them to postpone unnecessary plans for trips to Mexico and America.
cwmt2009	ce-news	zh_en_news_trans	zh	en	墨西哥卫生部27日晚宣布，墨西哥全国确认及疑似猪流感死亡人数升至152人。	The Health Ministry of Mexico declared on the evening of April 27 that the death toll of people dying of confirmed and suspected swine flu cases rose to 152 people.	Mexico's Health Ministry declared on April 27 that the number of casualty from confirmed and suspected cases of swine flu increased to 152.	Ministry of Health in Mexico announced on the night of 27th that the death toll of confirmed or suspected swine flu cases had risen to 152 across the country of Mexico.
cwmt2009	ce-news	zh_en_news_trans	zh	en	本报讯　历时7年、首部全面反映20世纪汉语方言基本面貌的《汉语方言地图集》，昨天在北京语言大学首发。	The "Chinese Dialects Atlas", the first map of reflecting Chinese dialects' basic features in the 20th century and of which the compilation it has taken seven years to finish, was launched at Beijing Language and Culture University yesterday.	The Atlas of Chinese Dialects, the first one fully reflecting the basic status of the Chinese dialects in the 20th century, which took seven years to complete, was published first yesterday in Beijing Language and Culture University.	Report from our correspondent Through seven years, the first one that fully reflects the basic outlooks of Chinese dialects in the 20th century, "Atlas of Chinese Dialects", was first issued in Beijing Language and Culture University.
cwmt2009	ce-news	zh_en_news_trans	zh	en	据该书主编、北京语言大学语言研究所所长曹志耘介绍，“汉语方言地图集”课题始于2001年。	According to Cao Zhiyun, chief editor of this book and director of the Institute of Linguistics of Beijing Language and Culture University, the research project of "Chinese dialects atlas" was initiated in 2001.	According to Cao Zhiyun, editor in chief of the book and director of the Language Research Institute, Beijing Language and Culture University, "the program of Atlas of Chinese Dialects" was initiated in 2001.	As introduced by Cao Zhiyun, the chief editor of this book and Director of Beijing Language Institute of Beijing Language and Culture University, "Atlas of Chinese Dialects" subject was started in 2001.
cwmt2009	ce-news	zh_en_news_trans	zh	en	来自国内外34所高校和研究单位参与了调查，遍及全国（包括港澳台）各地930个调查地点，最后归纳出最有价值的510个地图条目，终于2008年结题。	34 Chinese and foreign universities and research institutes have took part in the survey which covered 930 survey sites in China (including Hong Kong, Macao and Taiwan). Finally, 510 most valuable map entries were concluded and the research project was completed in 2008.	The investigation, with participation of 34 universities and research institutes from home and abroad, covers 930 sites of China (including Hong Kong, Macao and Taiwan). Finally, 510 most valuable map items were summarized and the program was completed in 2008.	34 universities and research units from home and abroad participated in the surveys that covered 930 survey points across China (including Hong Kong, Macao and Taiwan), and finally summed up 510 map items that are most valuable. Finally, the subjected was concluded in 2008.
cwmt2009	ce-news	zh_en_news_trans	zh	en	这部原创性语言特征地图集，分语音、词汇、语法3卷，内含510幅绘制的方言特征分布地图。	This original atlas of linguistic features consists of three sections of phonetics, vocabulary and grammar and contains 510 maps of dialects' distribution characteristics.	The original atlas of language characters is divided into three parts, phonics, lexics and grammar, including 510 maps of dialect character distribution.	The original language characteristics atlas is divided into three columns for phonetics, lexicon and grammars. It contains 510 dialect characteristics distribution maps that are drawn up.
cwmt2009	ce-news	zh_en_news_trans	zh	en	愈夜愈美丽：全球14座名城夜色大比拼	More beautiful at night: night views of 14 famous cities in the world	The latter the more beautiful: night scene competition of 14 famous cities	More Beautiful Deeper into Night: Comparison of Night Scenes in 14 Famous Cities around the Globe
cwmt2009	ce-news	zh_en_news_trans	zh	en	夜是魅惑，夜是美丽。	The night is glamorous and beautiful.	The night is charming and beautiful.	Night is charming, night is beautiful.
cwmt2009	ce-news	zh_en_news_trans	zh	en	夜是城市最好的语言，却无须诉说，一切尽在不言中。	The night is the best language for a city but it needn't be described since all views of a night city can be appreciated in silence.	The night scene is the best language of a city, but no need to speak out. All is reflected in silence.	Night is the best language for the city, but needs not to be spoken out. All is understood and no words are necessary.
cwmt2009	ce-news	zh_en_news_trans	zh	en	夜是都市最好的皮肤，却无需盛装，浓妆淡抹总相宜。	The night is the best skin of a city but it needn't be extraordinarily dressed up since it is always suitable for a night city to whether richly decorated or simply ornamented.	The night scene is the best skin of a city, but no need to dress up. It is always suitable no matter in heavy dress-up or light dress-up.	Night is the best skin for the city, but needs not to be well dressed. It is pretty in a gay dress, and pretty in simple again.
cwmt2009	ce-news	zh_en_news_trans	zh	en	如果你热爱生活、热爱城市，就先从热爱夜开始吧——融入这浓浓夜色中!	If you love lives and cities, you should first love the night -- and immerse yourself in the deep night!	If you love life, and love a city, then you can start with loving the night scene-melting into the deep night scene.	If you love life, and love cities, then start from loving the night -- get involved in the deep deep night scenes!
cwmt2009	ce-news	zh_en_news_trans	zh	en	巴西·里约热内卢(Rio de Janeiro)	Rio de Janeiro (Rio de Janeiro), Brazil	Brazil Rio de Janeiro (Rio de Janeiro)	Brazil Rio de Janeiro (Rio de Janeiro)
cwmt2009	ce-news	zh_en_news_trans	zh	en	里约是迷人的……它依山傍海，千楼万宇点缀盘绕在弯弯曲曲的山水之间。	Rio is so charming... It is situated at the foot of a mountain and beside a sea and in the city, numerous buildings are dotted between the wriggling mountain and the zigzag coastal line.	Rio is charming... adjacent to mountains and the sea, with numerous buildings dotted among zigzag mountains and rivers.	Rio is charming... It has the ocean and hills at its elbow, and the thousands of buildings are spotted and winding amongst the winding hills and waters.
cwmt2009	ce-news	zh_en_news_trans	zh	en	巴西人把它称为“奇妙的城市”。	Brazilian people call it the "wonderful city".	Brazilian calls it "a wonderful city".	Brazilians call it the "magical city".
cwmt2009	ce-news	zh_en_news_trans	zh	en	我也以为，里约风情万千，它让你百看不厌。	I also think Rio is very attractive and always has great appeal to you.	I do think Rio is so appealing that it will never make you feel bored.	I also believe that Rio is appealing, and it's worth watching a hundred times.
cwmt2009	ce-news	zh_en_news_trans	zh	en	“里约”是南美洲巴西的海滨城市“里约热内卢”。	"Rio" is a seaside city named "Rio de Janeiro" in Brazil, the South America.	Rio is the coastal city of Brazil, South America, Rio de Janeiro.	"Rio" is "Rio de Janeiro", the coastal city in Brazil, South America.
cwmt2009	ce-news	zh_en_news_trans	zh	en	也许这个名称对于中国人来说太拗口了，因此我们都习惯简称它为“里约”。	Maybe this name is too awkward-sounding for Chinese so we usually refer to it as "Rio".	Maybe the name is too awkward-sounding for Chinese; therefore we are used to shortening it to Rio.	Maybe the name is too mouthful to Chinese, thus we usually call it with the abbreviated "Rio".
cwmt2009	ce-news	zh_en_news_trans	zh	en	在葡萄牙语里，“里约热内卢”意为“一月之河”，是一个充满诗情画意的词，因为一月是里约的盛夏季节，阳光灿烂、鲜花盛开，山青水蓝，游人如织。	In Portuguese, "Rio de Janeiro" means "the river in January" and is idyllic and picturesque because January is the midsummer of Rio where it is sunny, various flowers are blooming, the mountain is green and the sea is blue and every street is swarming with tourists.	In Portuguese, Rio de Janeiro means "River in January". It is an idyllic word because in January, Rio is in the midsummer with gorgeous sunlight, blooming flowers, green mountains, clear waters and numerous visitors.	In the Portuguese language, "Rio de Janeiro" means "river of January". It's a term of poetic charms, for January is the summer season for Rio, the sun is shining brilliantly, the flowers are blossoming, the mountains are green and waters clear, and the visitors come and stay.
cwmt2009	ce-news	zh_en_news_trans	zh	en	不过，这个地名却来自一个阴差阳错的判断。	However, this name came from a mistake judgment.	However, the name came from an accidental mistake judgment.	However, the name is originated from a mistaken judgment.
cwmt2009	ce-news	zh_en_news_trans	zh	en	1502年，葡萄牙王室派遣一支探险队沿着巴西海岸考察。	In 1502, the royalty of Portugal dispatched an expedition to conduct a survey along the coastal line of Brazil.	In 1502, the Portugal royal family sent an expedition to make investigation along Brazil coast line.	In 1502, Portuguese crowns sent an exploration team for expedition along the Brazilian coasts.
cwmt2009	ce-news	zh_en_news_trans	zh	en	当探险队来到这里时，看见两座陡峭的山峰扼守着一个巨大的葫芦状的河湾。	When the expedition came here, the members of expedition saw a large cucurbit-shaped river bend between two mountain crests.	When the expedition arrived there, they saw two steep mountains guarding a huge calabash-shaped river bend.	When the exploration team came here, they saw two steep peaks were guarding a giant gourd-shaped river bend.
cwmt2009	ce-news	zh_en_news_trans	zh	en	他们误以为这是一条大河的入海口，当时又值盛夏一月，便用“一月之河”为其取名。	They mistook it for a long river's mouth and named it "the river in January" because it is in the midsummer of January.	They thought it was an estuary of a large river by mistake. As it was in January at that time, they named it "the River in January".	They mistakenly took it as the entrance to a big river, and then it was the summer in January. So they named it "river of January".
cwmt2009	ce-news	zh_en_news_trans	zh	en	后来，人们才发现，其实这片水域不是一个河湾，而是由大西洋海水入侵形成的海湾。	Afterward, people found it was not a river bend but a gulf formed due to the erosion of the Atlantic Ocean.	Later people found the waters was not a river bend, but a bay eroded and formed by the Atlantic Ocean.	Afterwards, it was found that the waters were not a river, but the bay formed by the intrusion of waters from the Atlantic.
cwmt2009	ce-news	zh_en_news_trans	zh	en	海湾内水深浪静，是一个天赐的良港。	The gulf is very deep and almost doesn't have any big waves so it is a god-given good harbor.	In the bay the water is deep and the wave is small. It is a heaven-sent harbor.	Inside the bay, the waters are deep and waves are quiet, It's a great natural harbor.
cwmt2009	ce-news	zh_en_news_trans	zh	en	葡萄牙殖民者在海湾的北岸建起了码头，将巴西的红木、黄金、宝石、蔗糖、咖啡、可可等源源不断地运往欧洲。	The Portuguese colonists established a dock on the northern bank of the gulf in order to transfer Brazilian rosewood, gold, jewelry, cane sugar, coffee, cocoa and other products to Europe.	Portuguese colonists built docks on the north side of the bay and transported the rosewood, gold, precious stone, cane sugar, coffee and cocoa to Europe.	Portuguese colonists built docks on the northern bank of the bay, and kept transporting the mahogany, gold, diamond, sucrose, coffee, cocoa and others in Brazil to Europe.
cwmt2009	ce-news	zh_en_news_trans	zh	en	里约随着对外贸易的扩张而迅速地发展起来，而阴差阳错的地名又赋予了这座城市传奇般的色彩。	With the expansion of foreign trade, Rio rapidly develops and the mistaken name also endows this city with some legendary colors.	Rio developed rapidly with the foreign trade expansion. The name added legendary color to the city.	Rio develops quickly with the expansion of foreign trade, and the name it got mistakenly gives the city a legendary color.
cwmt2009	ce-news	zh_en_news_trans	zh	en	加拿大·多伦多(Toronto)	Toronto (Toronto), Canada	Canada. Toronto (Toronto)	Canada Toronto
cwmt2009	ce-news	zh_en_news_trans	zh	en	人们常说“走一趟多伦多，仿佛走了一遍世界”，因为多伦多拥有来自世界各国的种族，并且在此生根发展。	People always say "if you travel around Toronto, you seem to have travelled around the world" because many different races from the world live in Toronto, and they have been enrooted in the city.	It is often said "it seems you have traveled around the whole world if you visited Toronto" because Toronto houses ethnic groups from various countries of the world. These ethnic groups took root there and grew there.	People always say that "a trip around Toronto is like a tour around the world". Because Toronto is home to the races coming from countries around the world, who take root and grow up here.
cwmt2009	ce-news	zh_en_news_trans	zh	en	走进中国城，迎面而来的是最道地的中国料理;走在希腊城(Greektown)，雅典城仿佛重现;而在小意大利(Little Italy)，道地的卡布其诺正等着玩累的游客。	Waking into Chinatown, you can taste the very genuine Chinese-style cuisines; Walking in Greektown (Greektown), you will feel it like a copy of Athens; while in the Little Italy (Little Italy), the genuine Cappuccino is waiting for the tired tourists.	In Chinese town, you will see the most trueborn Chinese food; in Greek town, it seems Athens is reproduced there; in Little Italy, the trueborn cappuccino is ready for the tired tourists.	Coming into the China Town, you'll meet the most authentic Chinese cuisines; walking in Greektown (Greektown), you'll see the re-appearing of Athens City; in Little Italy (Little Italy), the real Cappuccino is waiting for the tourists that are tired from playing.
cwmt2009	ce-news	zh_en_news_trans	zh	en	因为存在这么多的种族民情，把多伦多装扮得风味十足!	As so many folk customs of different races exist in Toronto, Toronto is decorated with many special flavors!	So many ethnic groups there make Toronto charming!	Because of the existence of so many race customs, Toronto is decorated really charming!
cwmt2009	ce-news	zh_en_news_trans	zh	en	多伦多亦是世界三大歌剧之城，在这里每年都可看到不同的戏码，为多伦多添了几许艺术气质。	Toronto is also the third biggest opera city and many different operas can be seen there every year, which endows Toronto with some artistic atmospheres.	Toronto is also one of the Top 3 cities of opera. Here you can watch different programs each year, which adds artistic quality to Toronto.	Toronto is also the city of three operas in the world. Here, one can see different plays every year, which adds some artistic colors to Toronto.
