datasource	domain	setid	srclang	trglang	src	ref1	ref2	ref3
cwmt2009	ce-news	zh_en_news_trans	zh	en	青年周末：过去你并没有固定的读书地点和时间？	Youth Weekend: In the past, did you not have fixed locations and time to read books?	Youth Weekend: Didn't you have fixed reading site and time before?	Y Weekend: You did not have fixed place and time for reading in the past?
cwmt2009	ce-news	zh_en_news_trans	zh	en	蔡伟：为生活奔波，地方不固定，时间也很不充足。	Cai Wei: For living, I had to hard work and I didn't have fixed locations and sufficient time to read books.	Cai Wei: I have to dash about for making a living. The location was not fixed and I had not sufficient time.	Cai Wei: Running about for life. The place was not fixed, and time was not that sufficient.
cwmt2009	ce-news	zh_en_news_trans	zh	en	高中毕业后我在锦州市橡胶厂当了三年胶管工人，下班后的时间都用来看书，要么在家要么去图书馆。	After graduating from the senior high school, I became a rubber pipe worker and worked in Jinzhou Rubber Plant. I spent all my spare time reading books at home or in libraries.	After the high school, I worked as the rubber tube worker in Jinzhou Rubber Plant for three years. I spent all my spare time in reading, at home or in the library.	After graduation from the high school, I worked as a rubber hose worker for three years at Jinzhou Rubber plant. The time after work was all spent in reading, either at home or in the library.
cwmt2009	ce-news	zh_en_news_trans	zh	en	后来厂里效益不好，我下岗了。	Afterwards, the plant made poor profit and I was laid off.	Later the plant suffered from poor performance and I was laid off.	Later, the plant's economic efficiency was not desirable, and I was laid off.
cwmt2009	ce-news	zh_en_news_trans	zh	en	办了个执照摆起路边摊，就坐在摊边看书，一天摆八九个小时的摊，大概可以看４个小时左右的书。	And then I got a business license and began to run a booth on the roadside and read while vending. Every day I worked about eight or nine hours and might possibly read books for four hours.	I registered for a business license and set up a booth by the street. I opened the booth for eight to nine hours a day and could read books by the booth for about four hours.	I applied for a license to be a street vendor. I read while sitting by the site. For a day, the street vending would take 8 or 9 hours, and I approximately read about 4 hours.
cwmt2009	ce-news	zh_en_news_trans	zh	en	看书是一定要记笔记的，没有桌子，就垫在腿上记，有时候为了记录方便，我就会用烟纸记录，现在我的一些书里还夹着烟纸笔记呢。	It is indispensable to take notes when reading books. Because I didn't have a desk, I put the notes on my legs to record. Sometimes, to conveniently make records, I used the paper of cigarette packet to take notes. And till now, some of my books contain the notes on the paper of cigarette pack.	Taking note is a must when reading books. Since I had no table, I took note by putting the notebook on my thigh. Sometimes I record with the cigarette box paper for convenience. Some of my books still clip some notes on the cigarette box paper.	One must take notes while reading. Without a desk, I took notes with my legs as padding. Sometimes, for convenient note-taking, I would use the tobacco paper. Now, tobacco paper notes are still included in some of my books.
cwmt2009	ce-news	zh_en_news_trans	zh	en	青年周末：有没有人说过您书呆子之类的？	Youth Weekend: Did anyone describe you as pedantic?	Youth Weekend: is there anybody calling you bookworm?	Y Weekend: Anyone says you're a bookworm or the like?
cwmt2009	ce-news	zh_en_news_trans	zh	en	蔡伟：周围的人怎么看我，我没在意，反正不少人说，学这有什么用啊。	Cai Wei: I didn't mind the surrounding people's opinions but many people said it was wasting time to study that.	Cai Wei: I do not care how the others look at me. Anyway many said what for to study this.	Cai Wei: I don't care how the people around look at me. Well, a number of guys said what's the use of learning this.
cwmt2009	ce-news	zh_en_news_trans	zh	en	不过，我旁边有蹬三轮的，是大学毕业生，他老是鼓励我说，读书还是有用的。	However, one of the tricycle drivers who graduated from a university always encouraged me and said it was useful to read some books.	However, there was a graduate who also pedaled the tricycle. He always encouraged me that it was useful to read books.	However, someone around me that pedals a pedicab is a university graduate. He has always encouraged me, saying reading is still useful.
cwmt2009	ce-news	zh_en_news_trans	zh	en	现在在复旦，我每天早上6点钟就到研究中心，晚上10点回宿舍。	Currently, at Fudan University, I arrive at the institute at 6:00 am and go back to my dormitory at 10:00 pm every day.	Now in Fudan I come to the research center at 6:00 am and return to the dorm at 10:00 pm.	Now in Fudan, I arrive at the research center at 6 o'clock in the morning everyday, and go back to the dormitory at 10 in the night.
cwmt2009	ce-news	zh_en_news_trans	zh	en	一整天就在办公室看书做研究，感觉很幸福。	I feel very happy because I can read books and carry out research in the office for a whole day.	I spend the whole day in the office reading and doing research. I feel very happy.	For a whole day, reading and making researches in the office, I feel quite happy.
cwmt2009	ce-news	zh_en_news_trans	zh	en	还是现在的环境很利于我的发展。	It is the current environments that are beneficial to my development.	It is the current environment conducive to my development.	Still, the current environment is quite favorable for my development.
cwmt2009	ce-news	zh_en_news_trans	zh	en	青年周末：现在大学体制还没到你想怎么做学问就做，想怎么读书就读吧？	Youth Weekend: Couldn't you read books and carry out research as your will under the current system of university?	Youth Weekend: the current college system does not allow you to do research and read books in the way as you wish, does it?	Y Weekend: The current university system is not to the extent that you can do researches in the way you like, and read in the way you want?
cwmt2009	ce-news	zh_en_news_trans	zh	en	蔡伟：进入学校，自然要按照学校的规矩来行动，这些规矩和我以前的读书条件相比，真的不算什么。	Cai Wei: After entering the university, I must comply with the rules of university but compared with my past reading conditions, those rules are not difficulties.	Cai Wei: In the school, you naturally have to act according to the rules of the school. Compared with the reading conditions I had before, these rules are really nothing difficult for me to observe.	Cai Wei: Admitted into the university, of course I shall act in accord with the school regulations. Compared with the reading conditions in the past, these regulations are really nothing.
cwmt2009	ce-news	zh_en_news_trans	zh	en	写论文、做研究本来就是我喜欢的。	Writing papers and carrying out research are what I like.	Writing papers and doing research are what I like.	Writing essays and doing research is right what I like.
cwmt2009	ce-news	zh_en_news_trans	zh	en	学外语那就学日语吧，反正我们学古代汉语的都需要了解日本的汉学研究。	As to foreign languages, let me study Japanese as we who study ancient Chinese need understand Japan's research on Sinology.	Foreign language I will choose Japanese. After all, we need to learn about the Chinese study of Japan for those who study the ancient Chinese language.	To learn a foreign language, then to learn Japanese. After all, people studying on ancient Chinese language need to know the researches on Chinese language in Japan.
cwmt2009	ce-news	zh_en_news_trans	zh	en	感兴趣的，从来不觉难吧。	If you have interest, you will never feel it difficult.	If you have interest, you will never feel it difficult.	If you're interested, you never feel difficult.
cwmt2009	ce-news	zh_en_news_trans	zh	en	我们的问题并不全是体制问题，事在人为。	Our question doesn't totally lie in the system and I believe it all depends on one's efforts.	Not all of our problems can be attributed to the system. It all depends on one's effort.	Our problems are not all about the system problems. Human effort is the decisive factor.
cwmt2009	ce-news	zh_en_news_trans	zh	en	如果大学能给自学者提供方便，我会特别感激	If the university can provide conveniences for self-learners, I will especially express my gratitude.	If the universities can offer convenience for the self-study people, I would really appreciate it.	If the university will provide conveniences for the self-taught people, I'll much appreciated it.
cwmt2009	ce-news	zh_en_news_trans	zh	en	青年周末：你将近20年都在自学，怎么能保证自己学的路子是对的？	Youth Weekend: You have studied by yourself for nearly 20 years. How can you ensure your study direction is right?	Youth Weekend: In nearly 20 years you have been engaged in the self-study. How could you ensure your method is correct?	Y Weekend: You've been self-learning for almost 20 years. How can you make sure you're taking the right road of learning?
cwmt2009	ce-news	zh_en_news_trans	zh	en	蔡伟：最基础的东西必须得扎扎实实弄懂，弄透。	Cai Wei: The elementary knowledge must be thoroughly understood.	Cai Wei: The basic things must be completely understood, and absorbed.	Cai Wei: You have to get a solid understanding of the most fundamental things.
cwmt2009	ce-news	zh_en_news_trans	zh	en	从1991年到1994年，再加上高中的两年都在打基础，看的都是些非常基础的书，反反复复地读、背诵，读不懂就找相关的书看。	From 1991 to 1994, as well as in the two years in senior high school, I spent much time laying foundation, what I read were the elementary books, I repeatedly read and recited those books and if I couldn't understand, I read the relevant books.	From 1991 to 1994, in addition to the two years in the high school, I laid the foundation for my self-study. What I read are the fundamental books. I read them repeatedly and recited them. I read the relevant books if I met something I could not understand.	From 1991 to 1994, plus the two years in high school, it was all about laying the foundation. The books I read were on fundamentals, I read and recited repeatedly. For those I could not get through, I looked for relevant books to read.
cwmt2009	ce-news	zh_en_news_trans	zh	en	学习中吸取前人大家的经验也很重要，像王力先生说的怎么学习古代汉语，他的那些经验也应该反复学。	It is very important to assimilate other people's experience during the learning. For example Mr. Wang Li once explained how to learn the ancient Chinese and his experience should be repeatedly studied.	It is very important to absorb experience of the predecessors and the masters. For instance, Mr. Wang Li said how he studied the ancient Chinese scripts. His experience should be studied repeatedly.	It is also important to learn the experience of the great predecessors during the learning, like Mr. Wang Li's words on how to learn ancient Chinese language. His experience should be learned repeatedly.
cwmt2009	ce-news	zh_en_news_trans	zh	en	1994年之后，我有了不少自信，也逐渐知道该看些什么书了。	After 1994, I was more confident and knew what kinds of books I need read step by step.	Since 1994, I have had confidence and gradually knew what to read.	After 1994, I gained quite some self-confidence, gradually knowing what books I should read.
cwmt2009	ce-news	zh_en_news_trans	zh	en	青年周末：如果不能读书呢？	Youth Weekend: What if you couldn't read books?	Youth Weekend: If you could not read?	Y Weekend: What if you can not read?
cwmt2009	ce-news	zh_en_news_trans	zh	en	蔡伟：在来复旦前大概一年，我没有读书，在蹬三轮，每天10个小时，根本没时间读书。	Cai Wei: Within one year before I came to Fudan University, I didn't read books and rode the tricycle for the sustenance. Every day I had to ride the tricycle for 10 hours, so I didn't have time to read books.	Cai Wei: In the one year before coming to Fudan, I did not read books but pedal the tricycle. I worked 10 hours a day and had no time to read at all.	Cai Wei: For the year before coming to Fudan, I did not read, pedaling a pedicab, ten hours a day, no time for reading at all.
cwmt2009	ce-news	zh_en_news_trans	zh	en	没有办法，首先还得活下来。	I didn't have other choice because I had to earn my living first.	I had no choice. First of all, I had to live on.	No other choice. To make the survival first.
cwmt2009	ce-news	zh_en_news_trans	zh	en	我记得很清楚，1998年我到北京去看望裘教授的时候，他就和我说，要是想研究学术，必须把生活搞好了，能吃饱饭，才能有研究学术的条件。	I can clearly remember when I visited Professor Qiu in 1998, he told me if I wanted to carry out research, I must have a good life and be able to eat my fill first and then I might have conditions to carry out research.	I could remember clearly in 1998 when I visited Prof. Qiu in Beijing, he told me I must solve the living problem if I want to do the academic research. Only with enough to eat can one have the conditions to do the scholarly research.	I remember clearly that in 1998 when I visited professor Qiu in Beijing, he told me that to do academic researches, one has to be settled in life, taking full meals before having the conditions for academic researches.
cwmt2009	ce-news	zh_en_news_trans	zh	en	但是，我边蹬三轮边觉得，可能真的再也没有时间读书了。	However, while I was riding the tricycle, I thought maybe I would have no time to read books.	But I thought I really had no time to read when I was pedaling the tricycle.	However, when pedaling the pedicab, I was thinking that I might not have the time to read.
cwmt2009	ce-news	zh_en_news_trans	zh	en	十多年都坚持下来了，这个时候没法坚持，特别可惜，内心非常灰暗，干什么都没劲。	I had persisted for more than 10 years but I couldn't persist at that moment so I felt very regretful, my mood was very sad and I didn't have vigor to do anything.	I had persisted for more than 10 years. I felt it a pity I could not continue at that time. I was gloomy and had no enthusiasm for doing anything.	Persistence for more than ten years, and at this time, unable to persist. It's really pitiful. I felt pale and dark inside, low-spirited for doing anything.
cwmt2009	ce-news	zh_en_news_trans	zh	en	青年周末：以前有过类似的感受吗？	Youth Weekend: Did you have the similar feelings in the past?	Youth Weekend: Did you have similar feelings before.	Y Weekend: Did you have similar feelings in the past?
cwmt2009	ce-news	zh_en_news_trans	zh	en	蔡伟：有觉得很可惜的时候。	Cai Wei: I once felt very sorry.	Cai Wei: I felt it pity sometimes.	Cai Wei: There were times I felt really pitiful.
cwmt2009	ce-news	zh_en_news_trans	zh	en	比如我去锦州市图书馆看书，有些线装的古典书籍需要你有文凭，有什么职称才借给你，我就看不了，心里觉得很可惜也无奈。	For example I went to Jinzhou Library to read books but some thread-bound classical books could be borrowed only by readers with high diplomas or special professional titles so I couldn't read them and felt very sorry and helpless.	For instance, when I read books in Jinzhou Library, some classical books with traditional thread binding could only be lent to somebody with certain diploma or technical titles. I had no such a qualification. I felt sorry and helpless.	For instance, I came to Jinzhou Municipal Library to read books. You are required to have a diploma, a certain professional title to be entitled to borrow some thread-bound ancient books. I could not read. I felt quite pitiful and helpless.
cwmt2009	ce-news	zh_en_news_trans	zh	en	我去锦州师范学院（现渤海大学）的图书馆，也只借给本校学生和有职称的。	When I went to the library of Jinzhou Normal College (currently Bohai University), the books there were only lent to the college's own students or people with special professional titles.	I came to the library of Jinzhou Normal University (current Bohai University). The library only lent books to students of the university and those who had a technical title.	I went to the library of Jinzhou Normal College (currently Bohai University), books were only lent to students in the school and those with a professional title.
cwmt2009	ce-news	zh_en_news_trans	zh	en	我找过校长，希望能让我借书或者进去看书，结果人家说，你看不懂，我那时候觉得特别懊恼。	I once visited the president and hoped he could allow me to borrow some books or enter the library to read books. But he said those books were too difficult for you to read and at that time, I felt very chagrined.	I had talked to the president and hoped I could borrow books from the library or read books there. But the president said you could not understand the books. I felt chagrined at that time.	I went to the college president, hoping I could be allowed to borrow the books or get into it to read. The result was, he said that you could not understand. I felt really upset at that time.
cwmt2009	ce-news	zh_en_news_trans	zh	en	所以很多多年都想看的书都是我到了复旦以后才看到的。	Thus, many books I have looked forward to reading for many years were read after I came to Fudan University.	Therefore, many books I had wished to read for years were read after I came to Fudan.	So, I did not read many books that I had aspired to read for years until I came to Fudan.
cwmt2009	ce-news	zh_en_news_trans	zh	en	如果大学或者图书馆能给自学的人提供一些方便，我会特别感激。	If universities and libraries could provide some convenience for self-learners, I will be very grateful.	If the universities or libraries could offer some convenience for those who engage in self-study, I would really appreciate it.	If the universities or libraries can provide some conveniences to those self-taught people, I'll really appreciate it.
cwmt2009	ce-news	zh_en_news_trans	zh	en	青年周末：如果复旦大学没有给你打电话，你很有可能就再也不能读自己喜欢的书了？	Youth Weekend: If Fudan University hadn't called you by telephone, would you have had no opportunity to read your favorite books?	Youth Weekend: If Fudan University did not call you, you probably could not read the books you like?	Y Weekend: if Fudan University did not call you, most probably you will not be able to read the books you like?
cwmt2009	ce-news	zh_en_news_trans	zh	en	蔡伟：的确是这样的。	Cai Wei: Yes, it's true.	Cai Wei: Actually yes.	Cai Wei: Yes, indeed so.
cwmt2009	ce-news	zh_en_news_trans	zh	en	那时基本不可能有时间看书，感觉有些绝望。	At that time, it was nearly impossible to find time to read books so I felt somewhat disappointed.	At that time I could not have time to read. I felt despairing.	At that time, it was basically impossible for me to get the time to read. I felt somewhat desperate.
cwmt2009	ce-news	zh_en_news_trans	zh	en	青年周末：在你最绝望的时候，希望的曙光就出现在你的面前了？	Youth Weekend: When you felt the most disappointed, did a gleam of hope emerge in front of you.	Youth Weekend: At the moment you felt the most despairing, the first light of hope appeared before you?	Y Weekend: When you were most desperate, the light of hope appeared in front of you?
cwmt2009	ce-news	zh_en_news_trans	zh	en	蔡伟：我也不太清楚，记得接到复旦大学的电话让我做特聘研究员时，我车上正载着一对老知识分子。	Cai Wei: I couldn't clearly remember but only remembered when I received the Fudan University's call in which they invited me to become a special researcher, my tricycle was carrying a couple of old intellectuals.	Cai Wei: I do not know either. I remember when I received the call from Fudan University asking me to work as a specially engaged researcher, I was carrying a couple of old intellectuals on the tricycle.	Cai Wei: I'm not quite clear. I remember when receiving the call from Fudan University that asked me to be the special researcher, my pedicab was carrying a couple of old intellectuals.
cwmt2009	ce-news	zh_en_news_trans	zh	en	我觉得不太可能，有点不可思议也很突然。	I couldn't believe it was true and felt it was incredible and very sudden.	I felt it was impossible, weird and sudden.	I thought it a bit impossible, a little incredible and unexpected.
cwmt2009	ce-news	zh_en_news_trans	zh	en	青年周末：没有特别兴奋？	Youth Weekend: Did you feel very excited?	Youth Weekend: Not extremely exciting?	Y Weekend: Not especially excited?
cwmt2009	ce-news	zh_en_news_trans	zh	en	蔡伟：那倒没有。	Cai Wei: No, I didn't.	Cai Wei: no.	Cai Wei: Not that.
cwmt2009	ce-news	zh_en_news_trans	zh	en	也是读了这么多书的人，有些宠辱不惊了吧。	However, I have read so many books so I might keep my head cool whether bestowed with favor or subjected to humiliation.	After all I am a person have read so many books, I could keep my head calm whether bestowed with favor or subjected to humiliation to some extent.	After all, someone having read so many books. Taking the rough with the smooth in a sense.
cwmt2009	ce-news	zh_en_news_trans	zh	en	从生活上来讲，我来这里做研究，每个月3000元生活费，的确解决了家里很大的困难，让我真的能潜下心来读书做研究。	In living, after I came here to carry out research, I can got a subsidy of 3,000 yuan every month. It really solves my family's problems so I can dedicate myself to reading books and carrying out research.	In terms of the living, I have 3,000 yuan each month for the costs of living to work here. The money really helps much in solving the problems of the family and enables me to read books and do the scholarly research with great concentration.	In terms of living, I come here to do researches, having RMB 3,000 Yuan living expenses a month. It really solves the difficulties for the family a lot, so that I can be devoted to reading and researches.
cwmt2009	ce-news	zh_en_news_trans	zh	en	裘先生一直非常愿意帮助真正爱读书做学问的人，这次和他一块举荐我的北大的李家浩先生当年也是他举荐，以初中生学历考上了他的研究生。	Mr. Qiu is always willing to help people who really love reading books and carrying out research. Mr. Li Jiahao from Peking University who jointly with Mr. Qiu recommended me to the Ministry of Education was recommended by Mr. Qiu in the past to take the postgraduate entrance examination and become Mr. Qiu's student with an education background of junior high school.	Mr. Qiu has always been eager to help those who really love reading books and doing scholarly research. Mr. Li Jiahou from Peking University, who recommended me together with Qiu this time, was recommended by him that year and was admitted as his postgraduate with a junior high school education record.	Mr. Qiu has always been willing to help those really interested in reading and learning. Mr. Li Jihao from Peking University that recommended me together with him this time was also recommended by him, passing the exam to be his graduate student with the junior middle school diploma.
cwmt2009	ce-news	zh_en_news_trans	zh	en	我想，这个世界的大门总会向有梦想的人敞开吧。	I think this world always opens a door for people with dreams.	I think the door of the world would finally open to those who have a dream.	I think the door to this world, after all, will be opened to those having dreams.
cwmt2009	ce-news	zh_en_news_trans	zh	en	采访手记：兴趣的魔力	Interview notes: Interest's mysterious power	Notes on the interview: charm of interest	Interview Notes: Magic of Interest
cwmt2009	ce-news	zh_en_news_trans	zh	en	蔡伟告诉记者，他的儿子今年已经读小学五年级了，但儿子是个小皮猴，不像自己那样喜欢读书，现在最大的兴趣就是玩儿。	Cai Wei told the reporter his son is studying in the fifth grade of primary school but he is very naughty and doesn't love to read books like Cai Wei and his biggest interest is playing.	Cai Wei told the journalist his son was a Grade Five pupil of the primary school. But his son was a naughty boy and did not like reading as him. His largest interest now is to play.	Cai Wei told the reporter that his son is in the 5th grade in elementary school this year. But his son is a little naughty monkey, not as interested in reading as him, and now his biggest interest is in playing.
cwmt2009	ce-news	zh_en_news_trans	zh	en	记者问他，你这样爱读书的人，看到这么一个不爱读书的儿子，是不是特别生气兼着急。	The reporter asked him, as he loved reading books very much, whether he felt very angry and worried when seeing his son who didn't like to read books so much.	The journalist asked him if he was very angry and anxious to have such a son not like reading for he was such a person loving books.	The reporter asked him that for a person that enjoys reading so much, are you pretty angry and worried to see a son that hates reading so much.
