datasource	domain	setid	srclang	trglang	src	ref1	ref2	ref3
cwmt2009	ce-news	zh_en_news_trans	zh	en	然而，不少公司普遍存在“重派出、轻管理”的问题，一些公司尽管派出的工人成百上千，却没有按规定派人在当地负责及时处理工人务工中可能遇到的问题，造成工人有事便找使馆。	However, many agencies "attach importance to the dispatchment but ignore the management". Some agencies have sent hundreds of workers to the foreign labor markets but don't send staff to take charge in time and deal with issues facing workers during the work, which causes the workers to ask for helps from the Chinese embassy when they encounter problems.	However, many companies have problems on "emphasizing dispatching but belittling management". Though some companies dispatched hundreds of workers, they did not send any personnel to the construction site to solve problems arising out of the laborer employment in time as stipulated, which caused the workers to come to the embassy as soon as any problem arose.	However, a number of agencies have a universal problem: "focusing on sending people out, but negligent of management". Although some agencies have sent hundreds of workers overseas, but have not assigned employees as required to the local sites to promptly handle the labor problems that might happen to the workers. As a result, the workers would come to the embassy whenever having troubles.
cwmt2009	ce-news	zh_en_news_trans	zh	en	有的公司在使馆反复催促下才派人，不仅使使馆的正常工作受影响，还错过了解决问题的最佳时机。	Some agencies need be urged repeatedly by the embassy to send staff, which not only influences the routine work of the embassy but also makes the best time for solving problems missed.	Some companies sent personnel upon repeated urgency from the embassy, which not only affected the normal work of the embassy, but also missed the best opportunity of solving the problem.	Some agencies do not send employees unless urged by the embassy for times, which affects the normal work of the embassy and misses the optimal time for solutions.
cwmt2009	ce-news	zh_en_news_trans	zh	en	也有公司尽管派出了前方管理人员，但据工人反映，这些人工作方式简单，甚至粗暴，致使双方失去起码的信任感。	Some agencies have sent some management staff but the workers indicate those staff do work in the simple and even rude ways so the workers and staff don't trust each other.	Though some companies send frontline managers, these managers employed simple, even rude means to cope with the problems, according to the workers. This caused loss of sense of trust between both sides.	Although some agencies send out frontier management, as reflected by the workers, the management people take to simple work style and are even bad-tempered, to the extent that they lose the minimum trust in each other.
cwmt2009	ce-news	zh_en_news_trans	zh	en	据不完全统计，目前在罗马尼亚务工的中国工人约有3000人，其中绝大多数是建筑工人。	According to the incomplete statistics, the current Chinese workers in Romania amount to 3,000, among which the majority are builders.	According to the incomplete statistics, there are about 3,000 Chinese workers in Rumania, and most of them are construction workers.	According to incomplete statistics, there are about 3,000 Chinese workers laboring in Romania now, most of whom are construction workers.
cwmt2009	ce-news	zh_en_news_trans	zh	en	经济危机导致罗马尼亚房地产市场严重萎缩，这种颓势在今后相当长的一段时间内难以根本扭转。	The economic crisis results in the severe shrinkage of Romanian real estate market and the declining tendency is hard to change essentially for a long time to come.	The economic crisis caused a serious shrinkage of Rumania's real estate market and the declining tendency could not be turned from the bottom for quite a long period.	The economic crisis results in a severe shrinkage of the real estate market in Romania, and this decline can hardly be fundamentally reversed in quite a long time.
cwmt2009	ce-news	zh_en_news_trans	zh	en	因此，中国工人在罗的务工条件很可能将随着当地建筑业的继续衰退而进一步恶化。	Thus, the working conditions of the Chinese workers may further deteriorate as the construction industry of Romania continues to decline.	Therefore, the employment conditions of the Chinese workers in Rumania could worsen accompanying the continuous decline of the construction industry of Rumania.	Therefore, the laboring conditions for Chinese workers in Romania might most probably deteriorate with the continued decline of local construction industry.
cwmt2009	ce-news	zh_en_news_trans	zh	en	奥巴马《希望》肖像挑战格瓦拉	Obama's portrait named "Hope" challenges Guevara's head portrait	Obama's Hope portrait challenges Guevara	Obama's Hope Portrait Challenges Guevara's
cwmt2009	ce-news	zh_en_news_trans	zh	en	头戴贝雷帽、留着连鬓的胡须、坚毅的目光注视着前方……自从1960问世以后，古巴革命家切·格瓦拉的这幅肖像已成为全世界被复制最多的头像。	Wearing a beret, growing a heavy beard, staring into the distance... Since appearing in 1960, Cuban Revolutionist Che Guevara's head portrait has been replicated the most times in the world.	Wearing beret, whiskers, firm and persistent eyes looking forward... Since produced in 1960, the portrait of Che Guevara, Cuban revolutionist, has become a head portrait with the largest reproduction in the world.	Wearing a beret cap and whiskers, fortitudinous eyes fixed into the front... Since the production in 1960, this portrait of Che Guevara, a Cuba revolutionist, is the most reproduced image in the world.
cwmt2009	ce-news	zh_en_news_trans	zh	en	近日，一部研究切·格瓦拉文化现象的新书《切的来世：一幅肖像的遗产》在美国出版。	Recently, a new book named "Che's Eternity: Heritage of a Portrait" that focuses on studying the cultural phenomenon of Che Guevara was published in the United States.	Recently, a new book themed Che's Eternity: Heritage of a Portrait is published in the US, studying Che Guevara cultural phenomena.	Recently, a new book studying on the Che Guevara cultural phenomenon, "The Legacy of Korda's Portrait of Che Guevara" was published in U.S.
cwmt2009	ce-news	zh_en_news_trans	zh	en	作者迈克·卡西在书中分析了格瓦拉头像流行的原因，并预测它很可能被奥巴马在竞选总统期间广为使用的《希望》肖像所超越。	Author Mike Casey in his book analyzes the reasons that cause the popularity of Guevara's head portrait and predicts it will probably be overtaken by Obama's portrait named "Hope", which was widely used in Obama's presidential election.	The author Mike Casey analyzed the reasons why Guevara's portrait is so popular and predicted it may be surpassed by the Hope portrait used by Obama over the period running for president.	The author Michael Casey analyses the reasons for the popularity of Guevara's portrait in his book, and predicts that it will most probably give way to the Hope portrait widely used by Obama in the presidential campaign.
cwmt2009	ce-news	zh_en_news_trans	zh	en	格瓦拉头像在东西方都深受欢迎	Guevara's head portrait is popular in both the East and the West	Guevara's portrait is popular in both the west and the east	Guevara's Portrait Widely Welcomed in East and West
cwmt2009	ce-news	zh_en_news_trans	zh	en	格瓦拉这张被称为“世界上最有革命性最有战斗性的头像”拍摄于1960年3月15日，使全世界人民得以一睹古巴传奇式革命英雄切·格瓦拉的风采，也使拍摄者柯尔达成为古巴乃至世界最著名的摄影师之一。	The photo of Guevara's head portrait entitled "the head portrait with the most revolutionist spirit and the most militancy in the world" was taken on March 15, 1960 with an aim to make all people in the world see the elegant demeanor of Che Guevara, a legendary revolutionist hero of Cuba. And it also made Korda, the photographer of this portrait, become one of the most famous photographers in Cuba and even in the world.	The portrait called "the most revolutionary and the most militant icon in the world" was taken on March 15, 1960. It enables all the peoples of the world to have a chance to see the elegant demeanor of Cuba's legendary revolution hero Che Guevara and made the photographer Korda one of the most famous photographers of Cuba and even the world.	Guevara's portrait, referred to as the "most revolutionist and most combative image in the world", was photographed on March 15th 1960, so that people across the world could catch a glimpse of the demeanor of Che Guevara, the legendary revolutionary hero in Cuba. It also makes the photographer Korda a most famous photographer in Cuba and even the world.
cwmt2009	ce-news	zh_en_news_trans	zh	en	对于当今世界来说，格瓦拉已成为一个庞大而复杂的文化现象，在东方和西方都深受欢迎。	To the existing world, Guevara has become a large and complex cultural phenomenon that is very popular in both the East and the West.	In today's world, Guevara has become a mass and complex cultural phenomenon and is very popular in both the east and the west.	To the current world, Guevara has become an enormous and complicated cultural phenomenon, widely welcomed in the East and the West.
cwmt2009	ce-news	zh_en_news_trans	zh	en	作为理想和自由的象征，格瓦拉的头像不仅出现于壁画、游行、音乐会等各种公共场合，也出现于邮票、服装、杯子、钥匙链、皮带等生活物品中。	As the symbol of ideal and freedom, Guevara's head portrait not only occurs in various public areas, including murals, parades and music parties, but also appears on the living commodities, such as stamps, clothes, cups, key chains and leather belts.	As an icon of ideal and freedom, Guevara's portrait not only appears in the fresco, parade, concert and on other public occasions, but also on the daily articles such as stamp, clothes, cups, key chains and belts.	As the symbol of aspirations and freedom, Guevara's portrait shows up not only on public occasions such as wall paintings, parades and music concerts, but also on daily items such as stamps, clothes, mugs, key chains and leather belts.
cwmt2009	ce-news	zh_en_news_trans	zh	en	正是这张头像，把一个职业革命者的形象，塑造成现代社会最成功、最持久的文化偶像。	It is the very head portrait that makes a professional revolutionist's image become the most successful and the most long-lived cultural idol.	It is the icon that fashioned an image of a professional revolutionist into the most successful and lasting cultural idol of the modern society.	It is this portrait that builds the image of a professional revolutionist into the most successful and most long-lasting cultural idol in the modern society.
cwmt2009	ce-news	zh_en_news_trans	zh	en	人们把自己的梦想投射到格瓦拉头像中	People project their dreams into Guevara's head portrait	People project their dreams to Guevara's portrait.	People Project Their Own Dreams into Guevara's Portrait
cwmt2009	ce-news	zh_en_news_trans	zh	en	《切的来世：一幅肖像的遗产》一书的作者迈克·卡西是道琼斯通讯社在阿根廷的负责人。	Mike Casey, the author of "Che's Eternity: Heritage of a Portrait", is the head of Dow Jones Newswires's branch in Argentina.	Mike Casey, author of the Che's Eternity: Heritage of an Icon, is the chief of Dow Jones Newswires in Argentina.	Michael Casey, author of "The Legacy of Korda's Portrait of Che Guevara" is the chief of Dow Jones Newswires' branch in Argentina.
cwmt2009	ce-news	zh_en_news_trans	zh	en	卡西花了三年的时间在拉丁美洲进行广泛调查，在书中分析了这幅画像是如何保持长久的生命、并成为人类历史上复制量最大的头像之一的。	Casey spent three years in conducting the widespread surveys in Latin America and he analyzed in his book how the head portrait kept a long life and how it became one of head portraits with the most copies in the human being's history.	Casey spent three years in Latin America making an extensive investigation and analyzed how the icon can maintain a long life and become one of the icons with the largest reproduction in the history of human being.	It took Casey three years to make wide investigations in Latin America. In the book, it analyzed how the portrait keeps the long life and becomes one of the most reproduced images in the human history.
cwmt2009	ce-news	zh_en_news_trans	zh	en	“它在世界的每个角落，在东帝汶、非洲、以色列、黎巴嫩等等地方，你都能找到它的身影。”	"It appears everyplace in the world. In East Timor, Africa, Israel, Lebanon and other places, you can find it."	"It lies in every corner of the world. In East Timor, Arica, Israel, Lebanon etc. you can see it."	"It is in every corner around the world. In East Timor, Africa, Israel, Lebanon and other places, you can all find it."
cwmt2009	ce-news	zh_en_news_trans	zh	en	“同样，无论是在美国还是在拉美，它都受到同样的欢迎。”	"Similarly, whether in the US or in the Latin America, it is very popular everywhere."	"Similarly, it is popular in the US and in Latin America."	"Also, either in U.S or Latin America, it is equally welcome."
cwmt2009	ce-news	zh_en_news_trans	zh	en	“这本书就是为了找到这种现象背后的原因。为什么它在世界任何一个角落都能如此流行？如此普适？”	"This book focuses on revealing the reasons for the phenomenon. Why is it so popular in every place of the world? And why is it so widely acceptable?"	"This book is to find out the reason behind the phenomena. Why is it so popular in every corner of the world? Why is it so ubiquitous?"	"The book is intended to find the reasons behind such a phenomenon. Why it is so popular in every corner of the world? So universally welcome?"
cwmt2009	ce-news	zh_en_news_trans	zh	en	卡西认为，当今世界正处于变革的阵痛中，各领域、各行业、各阶层的人们都将切·格瓦拉当成革命精神的象征。	Casey thought the current world is undergoing the pains brought by the changes and people in all fields, from all walks of life and at all social classes regarded Che Guevara as the symbol of revolutionist spirit.	According to Casey, the world is experiencing pain of changes. People in every field, trade and class take Che Guevara as the icon of the revolutionary spirit.	Casey believes that currently, the world is going through the pains of reforms, and people in all sectors, industries and on all social ladders will take Che Guevara as the symbol of revolutionary spirits.
cwmt2009	ce-news	zh_en_news_trans	zh	en	“不管人们是否相信格瓦拉是一位坚定的马克思主义者，他们需要的是希望和美好，而这两点均包容在这幅照片中，所以人们把自己的梦想投射其中。”	"Whether people believe Guevara was a resolute Marxian or not, what they need are hope and fairness, both of which are included in the portrait, so people project their dreams into it."	"No matter people believe Guevara is a steadfast Marxian or not, they need hope and goodness. Both are included in the icon. Therefore people project their dream to the icon."	"Either people believe Guevara as a firm Marxist or not, what they need is hope and goodness. The two points are both included in the portrait. So people project their dreams into it."
cwmt2009	ce-news	zh_en_news_trans	zh	en	“除了政治、艺术、市场、经济等方面的因素，我相信这是格瓦拉的头像如此流行的最核心的原因。”	"Besides political, artistic, marketing, economic and other factors, I believe it is the core reason rendering Guevara's head portrait so popular."	"In addition to the political, artistic, market and economic elements, I believe it is the core reason why Guevara's icon is so popular."	"Except for political, artistic, market, economical and other factors, I believe this is the core reason why Guevara's portrait is so popular."
cwmt2009	ce-news	zh_en_news_trans	zh	en	奥巴马《希望》肖像有可能超越格瓦拉	Obama's portrait of "Hope" may overtake Guevara's head portrait	Obama's Hope icon likely to surpass Guevara's	Obama's Hope Portrait Possibly to Surpass Guevara's
cwmt2009	ce-news	zh_en_news_trans	zh	en	尽管格瓦拉的这幅照片被誉为20世纪最著名的人像照片之一，但卡西认为，它很有可能被奥巴马的著名肖像《希望》所超越。	Although Guevara's head portrait is entitled one of the most famous portraits in the 20th century, Casey still believes it may be overtaken by Obama's famous portrait named "Hope".	Though Guevara's icon is crowned one of the most famous portraits in the 20th century, Casey thinks it probably will be surpassed by Obama's famous portrait Hope.	Although Guevara's portrait is reputed as one of the most well-known portraits in 1990s, Casey believes it might most probably give way to Obama's famous portrait Hope.
cwmt2009	ce-news	zh_en_news_trans	zh	en	《希望》由美国著名街头艺术家谢泼德·费尔雷为奥巴马创作，在奥巴马竞选总统过程中成为使用率最高、最受青睐的海报，并广泛地被用于各种竞选宣传品中。	The "Hope" was created by Shepard Fairey, a famous US street artist, for Obama, became the most popular and the most favorable poster in Obama's presidential election and was widely used on the propaganda materials for election.	Hope is produced by famous US street artist Shepard Fairey. It was the poster used the most frequently and most favored in the period when Obama was running for president. It was widely used in various competition promotions.	Created by Shepard Fairey, a celebrated street artist in U. S, for Obama, Hope was the most frequently used and most favored poster during Obama's presidential campaign, and widely applied on varied campaign publicity items.
cwmt2009	ce-news	zh_en_news_trans	zh	en	如今，这张红白蓝海报已成为奥巴马最深入人心的形象。	Currently, this red, white and blue poster has become Obama's image enrooted in people's mind.	Now the red-white-blue poster has become the most striking image of Obama.	Now, the red, white, and blue collage has become Obama's most popular image.
cwmt2009	ce-news	zh_en_news_trans	zh	en	“奥巴马深知形象的重要，”卡西说，“《希望》肖像流行背后的驱动力在很大程度上与格瓦拉的肖像类似。“	"Obama deeply understands the importance of an image," said Casey, "and the driving force under the portrait of 'Hope' is like that under Guevara's head portrait to a great extent."	"Obama knew very well the importance of image," said Casey, "the momentum driving the Hope icon to become popular is similar with that of Guevara's to a large extent."	"Obama well understands the importance of image," Casey says, "the driving forces behind the popularity of Hope portrait, to a large extent, are similar to Guevara's portrait."
cwmt2009	ce-news	zh_en_news_trans	zh	en	“显然他们是非常不同的人，但在某些方面却有相似之处。”	"Obviously, they are different people but they have similarities in some ways."	"Obviously they are quite different, while sharing similarity in some aspects."	"Apparently they are quite different people, but have similarities in some aspects."
cwmt2009	ce-news	zh_en_news_trans	zh	en	卡西说，美国与拉美长期以来都在进行着一场“山姆大叔VS切·格瓦拉”的品牌形象战，所以美国改善与拉美关系在很大程度上在于改善自己的形象。	Casey said there had been a brand and image battle of "Uncle Sam vs Che Guevara" between the US and Latin America for a long time so the improvement of relations between the US and Latin America lay in the improvement of the US's image.	Casey said the US and Latin America have long been in a brand image battle "Uncle Sam VS Che Guevara". Therefore, the US improving relationship with Latin America lies in improving its image to a large extent.	Casey says that for a long time, U.S and Latin America are engaged in a brand image campaign of "Uncle Sam VS Che Guevara", so U.S should, to a large extent, change its own image when improving the relationship with Latin America.
cwmt2009	ce-news	zh_en_news_trans	zh	en	以前，拉美并不买美国的账，现在美国有了“奥巴马”这个新品牌，起点比过去好多了。	In the past, Latin America didn't want to cooperate with the US. At present, the US has a new image, "Obama", so it has a good start.	Before Latin America did not give a damn to what the US said. Now the US has a new brand "Obama", and the starting point is much better than before.	In the past, Latin America did not show respect for U.S. But now, U.S has this new brand of "Obama", the starting point much improved than before.
cwmt2009	ce-news	zh_en_news_trans	zh	en	首届世界海洋大会在印尼万鸦老开幕	The first World Ocean Conference opens in Manado, Indonesia	First World Ocean Conference opened in Indonesia Manado	First World Ocean Conference Opened in Manado, Indonesia
cwmt2009	ce-news	zh_en_news_trans	zh	en	5月11日，中国代表团在印度尼西亚万鸦老出席世界海洋大会开幕式。	On May 11, Chinese delegation attended the opening ceremony of World Ocean Conference in Manado, Indonesia.	On May 11, the Chinese delegation is present at the opening ceremony of the First World Ocean Conference held in Manado, Indonesia.	On May 11th, Chinese delegation attended the opening ceremony of World Ocean Conference in Manado, Indonesia.
cwmt2009	ce-news	zh_en_news_trans	zh	en	当天，首届世界海洋大会在印度尼西亚万鸦老开幕，共有来自73个国家的官方机构和11个非政府组织的1835位代表参加。	On the same day, the First World Ocean Conference opened in Manado, Indonesia and totally 1835 delegates from 73 nations' official agencies and 11 non-governmental organizations participated in this conference.	On the same day, the first World Ocean Conference is opened in Manado, Indonesia, with participation of 1,835 representatives from 73 governmental organizations and non-governmental organizations.	On the day, the First World Ocean Conference was opened in Manado, Indonesia. 1,835 delegates from the official organizations of 73 countries and 11 non-government organizations attended.
cwmt2009	ce-news	zh_en_news_trans	zh	en	本届大会将主要讨论海洋与全球气候变化的关系等一系列议题。	This session will focus on discussing a series of topics, including the relations between ocean and global climate change.	The conference will mainly discuss a series of topics on the relation between oceans and the global climate changes.	The conference would mainly discuss a series of topics such as the relationship between the ocean and global climatic changes.
cwmt2009	ce-news	zh_en_news_trans	zh	en	为人父母压力大	Parents bear great pressure	High pressure of being parents	Heavy Pressures for Parents
cwmt2009	ce-news	zh_en_news_trans	zh	en	科学家们研究发现，90%的夫妇在有了第一个孩子之后对婚姻的满意度有所下降。	According to researches, scientists find 90% of couples suffer a downturn in ` marital satisfaction' once the first child is born.	The scientists find with research that 90% couples have declined satisfaction with their marriage after having the first child.	Through researches, the scientists find that 90% couples, after having the first baby, will have a lowered satisfaction with the marriage.
cwmt2009	ce-news	zh_en_news_trans	zh	en	随着时间的推移，没有孩子的夫妇的婚姻质量也会显现下降趋势，但有了孩子会加快其下降的速度。	With the lapse of time, childless couples also show diminished marital quality, but having a baby accelerates the deterioration.	With time passing on, the couples without children also face a decline tendency of marriage quality, but having children will accelerate the decline speed.	With the march of time, the marriage qualities of the couples without kids will also show apparent tendency to decline, but having a baby will accelerate the declining speed.
cwmt2009	ce-news	zh_en_news_trans	zh	en	与婚前没有在一起生活的夫妇相比，婚前同居的夫妇有孩子之后遭遇的问题更多，正如那些经常吵架甚至离婚的夫妇一样。	Compared with couples who didn't live together before marriage, the couples living together before marriage may encounter more questions after the birth of child, just like those who often quarrel and even get divorced.	Comparing with couples not cohabiting before marriage, cohabitant couples before marriage will face more problems after having a child, just like those who quarrel frequently or even get divorced.	Compared with couples that have not lived together before the marriage, couples living together before the marriage will have more problems after having babies, just like those couples always quarrelling or even divorced.
